Age,Gender,Job,Relationship Status,Triggering_Event,Emotional_Response,Subjective_Assesment
25,Male,Software Engineer,Single,My coworker took credit for my work during a team meeting.,"anger, frustration, betrayal",I felt so angry and betrayed when my coworker took credit for my hard work. It was incredibly frustrating to see them get praised for something I did.
25,Male,Software Engineer,Single,I found out my ex is dating someone new just a few weeks after our breakup.,"anger, jealousy, hurt",I was so angry when I saw pictures of my ex with their new partner. I couldn't believe they moved on so quickly after our relationship. It hurt to see them happy with someone else.
25,Male,Software Engineer,Single,A client yelled at me over the phone for a minor issue that wasn't my fault.,"anger, frustration, helplessness","I felt so angry and frustrated when the client started yelling at me. I tried to explain the situation calmly, but they wouldn't listen. It was so unfair to be blamed for something that wasn't my fault."
25,Male,Software Engineer,Single,My roommate ate my leftovers without asking me.,"anger, annoyance, disrespect",I was so angry when I discovered my roommate ate my leftovers without asking. It was annoying to come home hungry and find out my food was gone. I felt disrespected that they didn't even ask me first.
25,Male,Software Engineer,Single,I got stuck in traffic and missed an important meeting at work.,"anger, stress, embarrassment",I felt so angry and stressed when I realized I was going to be late for the meeting. I hate being stuck in traffic and feeling like I have no control over the situation. It was embarrassing to walk into the meeting late and have everyone staring at me.
25,Male,Software Engineer,Single,I have to give a presentation to the executive team about the project I've been working on. I'm worried I'll forget what I need to say or that they won't like my work.,"Anxiety, nervousness, self-doubt",I feel really anxious and nervous about this presentation. I'm doubting my abilities and worry that I'll mess up.
25,Male,Software Engineer,Single,"I saw my ex-girlfriend at a mutual friend's party. She was with her new boyfriend, and they looked really happy together. It made me feel inadequate and like I'll never find someone.","Anxiety, insecurity, loneliness",Seeing my ex with her new boyfriend triggered feelings of anxiety and insecurity. I felt lonely and like I'm not good enough to find a partner.
25,Male,Software Engineer,Single,"I applied for a promotion at work, but haven't heard back from my manager yet. I'm worried that I didn't get it and that I'm not progressing in my career as quickly as I should be.","Anxiety, impatience, self-doubt",I'm feeling anxious and impatient waiting to hear back about this promotion. I'm starting to doubt my qualifications and worry that I'm not good enough.
25,Male,Software Engineer,Single,"I had plans to hang out with a group of friends, but they cancelled at the last minute. Now I'm sitting at home alone on a Friday night.","Anxiety, loneliness, rejection",Having my friends cancel our plans triggered feelings of anxiety and loneliness. I feel rejected and like I'm missing out on social interaction.
25,Male,Software Engineer,Single,I received a large unexpected bill in the mail. I'm worried about how I'm going to pay for it and if this will set me back financially.,"Anxiety, stress, worry",Getting this bill triggered a lot of anxiety and stress for me. I'm worried about my financial situation and how I'm going to handle this expense.
25,Male,Software Engineer,Single,"I worked hard on a project for months, but my colleague who barely contributed got all the credit and recognition from our boss.","Bitterness, resentment, anger, frustration",I feel so bitter and resentful. It's unfair that my hard work went unnoticed while someone else got the praise.
25,Male,Software Engineer,Single,"My ex-girlfriend, who I thought was the love of my life, got engaged to someone else just six months after we broke up.","Bitterness, jealousy, sadness, betrayal",I can't help but feel bitter about how quickly she moved on. It's like our relationship meant nothing to her.
25,Male,Software Engineer,Single,"I applied for my dream job and made it to the final round of interviews, but they ended up hiring someone with less experience who happened to be friends with the manager.","Bitterness, disappointment, frustration, hopelessness",It's so frustrating and disheartening to know that nepotism played a role in the hiring decision. I feel bitter about the unfairness of it all.
25,Male,Software Engineer,Single,"My parents always favored my younger sibling and gave them more attention and support, even though I was the one who excelled academically and professionally.","Bitterness, resentment, jealousy, loneliness",I can't help but feel bitter and resentful towards my parents for their unequal treatment. It hurts to feel like I'm not good enough for them.
25,Male,Software Engineer,Single,"I've been single for years and have watched all my friends get married and start families, while I'm still struggling to find a meaningful relationship.","Bitterness, loneliness, envy, hopelessness",It's hard not to feel bitter when everyone around me seems to be moving forward in their lives while I'm stuck in the same place. I worry that I'll never find someone to share my life with.
25,Male,Software Engineer,Single,"My coworker took credit for my work during a team meeting, and my manager praised him for it.","Contempt, anger, frustration, betrayal","I feel so much contempt for my coworker. He's a manipulative, credit-stealing snake."
25,Male,Software Engineer,Single,"I saw my ex at a party with their new partner, and they were all over each other.","Contempt, jealousy, bitterness, resentment",Seeing them together filled me with contempt. They're so disgusting and pathetic.
25,Male,Software Engineer,Single,"I overheard my friends making fun of me behind my back, mocking my interests and personality.","Contempt, betrayal, hurt, anger","I feel so much contempt for my so-called friends. They're just a bunch of two-faced, backstabbing jerks."
25,Male,Software Engineer,Single,"A client at work was incredibly rude and condescending to me, treating me like I was incompetent.","Contempt, anger, frustration, humiliation","I have nothing but contempt for that client. They're an arrogant, entitled bully."
25,Male,Software Engineer,Single,I saw a politician on TV making ignorant and offensive comments about a marginalized group.,"Contempt, disgust, anger, outrage","I feel so much contempt for that politician. They're a bigoted, hateful person who has no place in a position of power."
25,Male,Software Engineer,Single,"I got passed up for a promotion at work, even though I have been working hard and putting in extra hours.","Despair, frustration, disappointment, hopelessness",I feel like my hard work doesn't matter and I'll never be successful in my career.
25,Male,Software Engineer,Single,"My girlfriend of 3 years broke up with me out of the blue, saying she doesn't see a future with me.","Despair, heartbreak, rejection, loneliness",I feel like I'll never find love again and that I'm unlovable.
25,Male,Software Engineer,Single,I found out that several of my close friends went on a trip together and didn't invite me.,"Despair, betrayal, exclusion, inadequacy",I feel like my friends don't actually care about me and that I'm not important to anyone.
25,Male,Software Engineer,Single,"I received a poor performance review at work, despite feeling like I've been doing a good job.","Despair, failure, shame, self-doubt",I feel like I'm a failure at my job and that I'll never be good enough.
25,Male,Software Engineer,Single,I applied to my dream graduate school program and got rejected.,"Despair, disappointment, failure, hopelessness",I feel like my dreams are crushed and that I'll never be able to achieve my goals.
25,Male,Software Engineer,Single,"I worked hard on a project for weeks, but my manager criticized it harshly in front of the entire team during the presentation.","Disappointed, embarrassed, undervalued",I felt really let down and embarrassed. It was like all my effort was for nothing.
25,Male,Software Engineer,Single,"I was really excited about a first date with someone I met online, but they cancelled on me at the last minute without a good reason.","Disappointed, rejected, foolish",I was so disappointed and felt kind of stupid for getting my hopes up.
25,Male,Software Engineer,Single,"I applied for my dream job and made it to the final round of interviews, but didn't get the position.","Disappointed, discouraged, inadequate",I was crushed. I really thought I had a good chance and not getting it was a huge disappointment.
25,Male,Software Engineer,Single,"My best friend and I made plans for a weekend trip, but they cancelled at the last minute to hang out with their new partner instead.","Disappointed, hurt, betrayed",I felt so disappointed and kind of betrayed. I was really looking forward to our trip.
25,Male,Software Engineer,Single,"I worked really hard to get in shape for a marathon, but on race day I performed much worse than I had hoped and didn't meet my goal time.","Disappointed, frustrated, ashamed",I was really disappointed in myself. All that training and I still couldn't reach my goal.
25,Male,Software Engineer,Single,I found out my roommate has been using my toothbrush without telling me.,Disgust,I feel so grossed out and violated.
25,Male,Software Engineer,Single,"I accidentally took a sip from a coworker's water bottle thinking it was mine, only to realize they had backwash in it.",Disgust,I feel so disgusted and nauseous.
25,Male,Software Engineer,Single,I was eating at a restaurant and found a hair in my food.,Disgust,I feel so grossed out and angry.
25,Male,Software Engineer,Single,I saw a video online of someone eating live insects.,Disgust,I feel so revolted and queasy.
25,Male,Software Engineer,Single,I was walking down the street and stepped in dog poop.,Disgust,I feel so disgusted and annoyed.
25,Male,Software Engineer,Single,I was presenting my project idea in a team meeting and my mind suddenly went blank. I couldn't remember what I wanted to say next and there was an awkward silence.,"Embarrassment, anxiety, self-doubt",I felt really embarrassed and anxious. It was like everyone was staring at me and judging me for not being prepared.
25,Male,Software Engineer,Single,I was out on a date with someone I really liked and I accidentally spilled my drink all over the table and myself.,"Embarrassment, clumsiness, self-consciousness",I was so embarrassed and felt like such a klutz. I could feel my face turning red and I just wanted to hide under the table.
25,Male,Software Engineer,Single,I was at the gym and my shorts ripped right down the back while I was doing squats. Everyone could see my underwear.,"Embarrassment, exposure, vulnerability",I was mortified. I could feel everyone's eyes on me and I just wanted to run out of the gym and never come back.
25,Male,Software Engineer,Single,I was in a meeting with my boss and some senior managers and I accidentally let out a loud burp. Everyone turned to look at me.,"Embarrassment, shame, unprofessionalism",I was so embarrassed and ashamed. I couldn't believe I had done something so unprofessional in front of my bosses.
25,Male,Software Engineer,Single,I was out with some friends at a bar and I had a few too many drinks. I ended up throwing up in the bathroom and my friends had to take me home.,"Embarrassment, shame, regret",I was so embarrassed and ashamed of myself. I couldn't believe I had let myself get so drunk and sick in public.
25,Male,Software Engineer,Single,"My coworker got promoted to a senior role after working here for only a year, while I've been here for three years without any advancement.","Envy, frustration, self-doubt",I feel envious and frustrated that my coworker got promoted so quickly while I'm still in the same position. It makes me doubt my own abilities and worth.
25,Male,Software Engineer,Single,"My best friend just got engaged and is planning a dream wedding, while I'm still single with no prospects.","Envy, loneliness, self-pity",I feel so envious of my friend's happiness and success in love. It makes me feel even more alone and like I'll never find someone.
25,Male,Software Engineer,Single,"A younger coworker just bought a brand new luxury car, while I'm still driving my old beat-up sedan.","Envy, inadequacy, resentment",I feel so envious and inadequate seeing my coworker's fancy new car. It makes me resent my own financial situation and feel like I'm not successful enough.
25,Male,Software Engineer,Single,"My college roommate just sold his startup for millions, while I'm still working a regular 9-5 job.","Envy, regret, bitterness",I feel so envious and bitter hearing about my old roommate's success. It makes me regret not taking more risks in my own career.
25,Male,Software Engineer,Single,"My sister just announced that she's pregnant with her second child, while I'm still single and childless.","Envy, sadness, fear of missing out",I feel so envious and sad hearing my sister's news. It makes me fear that I'm missing out on the joys of family life and will end up alone.
25,Male,Software Engineer,Single,I was working late at night on a critical project when my computer suddenly crashed and I lost all my unsaved work.,"Fear, panic, anxiety",I felt a surge of fear and panic as I realized I might miss the deadline and disappoint my team and clients.
25,Male,Software Engineer,Single,I received an email from my boss requesting an urgent meeting to discuss my performance.,"Fear, anxiety, self-doubt","I was gripped by fear and anxiety, wondering if I had done something wrong or if my job was in jeopardy."
25,Male,Software Engineer,Single,"I was on a first date with someone I met online, and they started asking very personal questions that made me uncomfortable.","Fear, unease, vulnerability","I felt a growing sense of fear and unease as the conversation took an uncomfortable turn, and I worried about my safety and well-being."
25,Male,Software Engineer,Single,I was alone in my apartment late at night when I heard strange noises coming from outside my door.,"Fear, anxiety, helplessness","I was suddenly gripped by fear and anxiety, my heart pounding as I imagined an intruder trying to break in."
25,Male,Software Engineer,Single,I was in a crowded elevator when it suddenly jerked and came to a halt between floors.,"Fear, panic, claustrophobia",I felt a wave of fear and panic wash over me as I realized I was trapped in the confined space with no way out.
25,Male,Software Engineer,Single,"I spent hours debugging my code, only to find out it was a simple syntax error.","Frustration, anger, self-doubt",I feel so frustrated and stupid for wasting so much time on such a small mistake.
25,Male,Software Engineer,Single,"My manager keeps setting unrealistic deadlines for our projects, causing me to work overtime frequently.","Frustration, stress, resentment",I'm so frustrated with my manager's lack of understanding and unreasonable expectations. It's stressing me out.
25,Male,Software Engineer,Single,I got rejected by a company I really wanted to work for after going through multiple interview rounds.,"Frustration, disappointment, self-doubt",I'm frustrated and disappointed that I didn't get the job. It makes me question my skills and abilities.
25,Male,Software Engineer,Single,I can't seem to find a date despite putting myself out there on multiple dating apps and attending social events.,"Frustration, loneliness, self-doubt",I'm frustrated with my lack of success in dating. It makes me feel lonely and wonder if there's something wrong with me.
25,Male,Software Engineer,Single,"My computer crashed in the middle of an important project, causing me to lose hours of unsaved work.","Frustration, anger, stress","I'm so frustrated and angry with myself for not saving my work more frequently. Now I have to redo everything, and I'm stressed about meeting the deadline."
25,Male,Software Engineer,Single,"My grandmother, who raised me, passed away unexpectedly.","Sadness, loss, emptiness, shock, disbelief",I feel devastated and lost without my grandmother. It's like a part of me is gone forever.
25,Male,Software Engineer,Single,"My childhood dog, who was my best friend growing up, had to be put down due to age-related health issues.","Grief, heartbreak, nostalgia, guilt",Losing my dog feels like losing a part of my childhood. I feel guilty for not spending more time with him in his final years.
25,Male,Software Engineer,Single,"I found out that my ex-girlfriend, who I still had feelings for, got engaged to someone else.","Jealousy, regret, loneliness, heartbreak",I feel like I missed my chance at happiness with her. Seeing her engage to someone else is a painful reminder of what could have been.
25,Male,Software Engineer,Single,"My best friend, who I've known since childhood, moved to another country for work.","Loneliness, abandonment, sadness, fear",I feel like I'm losing my support system and I'm scared of facing life's challenges without my best friend by my side.
25,Male,Software Engineer,Single,I didn't get the promotion at work that I had been working towards for months.,"Disappointment, frustration, self-doubt, hopelessness",I feel like all my hard work was for nothing. I'm starting to doubt my abilities and wonder if I'll ever advance in my career.
25,Male,Software Engineer,Single,I forgot my best friend's birthday and didn't even call him.,"Guilt, Shame, Regret",I feel terrible for forgetting such an important day. I'm a horrible friend.
25,Male,Software Engineer,Single,I promised to help my colleague with a project but got caught up in my own work and didn't deliver my part on time.,"Guilt, Disappointment, Embarrassment",I feel guilty for letting my colleague down and not keeping my word. I should have managed my time better.
25,Male,Software Engineer,Single,I accidentally deleted an important file at work and caused a delay in the project.,"Guilt, Panic, Self-blame",I feel incredibly guilty for causing this problem. I should have been more careful.
25,Male,Software Engineer,Single,"I haven't called my parents in weeks, and now I found out my dad was in the hospital.","Guilt, Worry, Regret",I feel so guilty for not staying in touch. I should have been there for them.
25,Male,Software Engineer,Single,I got drunk at a party and said some hurtful things to a close friend.,"Guilt, Shame, Remorse",I feel awful for hurting my friend's feelings. I shouldn't have let myself get so drunk and out of control.
25,Male,Software Engineer,Single,"I found out that my coworker, who I considered a friend, has been spreading rumors about me and sabotaging my work behind my back.","Betrayal, anger, frustration",I feel so much hatred towards him right now. I trusted him and he stabbed me in the back.
25,Male,Software Engineer,Single,"I was passed over for a promotion that I deserved, and it was given to someone who is less qualified but is better at office politics.","Resentment, bitterness, anger",I hate the fact that hard work and talent don't seem to matter in this company. It's all about who you know and how well you can play the game.
25,Male,Software Engineer,Single,"I found out that my ex-girlfriend, who broke up with me a few months ago, is now dating my best friend.","Betrayal, anger, jealousy",I hate both of them so much right now. How could they do this to me? I thought they cared about me.
25,Male,Software Engineer,Single,I was walking down the street when a group of people started yelling racial slurs at me and telling me to go back to where I came from.,"Fear, anger, humiliation","I hate that people can be so ignorant and hateful. I didn't do anything to them, but they still felt the need to attack me because of my race."
25,Male,Software Engineer,Single,I found out that my parents have been lying to me my entire life about my adoption and my biological family.,"Betrayal, anger, confusion",I hate that they kept this from me for so long. I feel like my entire life has been a lie and I don't know who I am anymore.
25,Male,Software Engineer,Single,I've been working on this project for weeks and my manager just told me that the requirements have changed and I need to start over from scratch.,"Helplessness, frustration, despair",I feel so helpless and frustrated. All my hard work has been for nothing and I don't know if I can handle starting over.
25,Male,Software Engineer,Single,I've been applying for jobs for months and haven't even gotten an interview. I feel like I'm never going to find a better job.,"Helplessness, hopelessness, inadequacy","I feel so helpless and hopeless. No matter how hard I try, I can't seem to get anywhere in my career."
25,Male,Software Engineer,Single,I've been trying to learn a new programming language but I just can't seem to grasp the concepts. I feel like I'm falling behind my colleagues.,"Helplessness, inadequacy, self-doubt",I feel so helpless and inadequate. Everyone else seems to be picking up this language so easily and I'm struggling to keep up.
25,Male,Software Engineer,Single,I've been single for so long and I just can't seem to meet anyone. I feel like I'm going to be alone forever.,"Helplessness, loneliness, hopelessness","I feel so helpless and lonely. No matter how hard I try, I can't seem to connect with anyone."
25,Male,Software Engineer,Single,I've been dealing with a bug in my code for hours and I just can't seem to figure out what's wrong. I feel like I'm not cut out for this job.,"Helplessness, frustration, self-doubt",I feel so helpless and frustrated. I've been staring at this code for hours and I'm no closer to a solution.
25,Male,Software Engineer,Single,"I applied for my dream job at a top tech company, but I got rejected after the final interview round.","Hopelessness, disappointment, self-doubt",I feel like a failure and that I'll never be able to achieve my career goals.
25,Male,Software Engineer,Single,"I've been single for years now, and I just got rejected by someone I really liked after our third date.","Loneliness, hopelessness, inadequacy",I'm starting to think that I'll never find someone who wants to be with me long-term.
25,Male,Software Engineer,Single,"I've been working on a personal coding project for months, but I can't seem to get it to work properly no matter how much time and effort I put in.","Frustration, hopelessness, self-doubt",I feel like I'm not good enough to be a software engineer if I can't even get this project to work.
25,Male,Software Engineer,Single,"I just found out that my best friend is moving to another country for a job opportunity, and I don't know when I'll see them again.","Sadness, hopelessness, abandonment","I feel like I'm losing one of the most important people in my life, and I don't know how I'll cope without them."
25,Male,Software Engineer,Single,"I've been trying to save money for years, but I just can't seem to make any progress no matter how much I cut back on expenses.","Hopelessness, frustration, anxiety",I feel like I'll never be able to afford my own place or have any financial stability in my life.
25,Male,Software Engineer,Single,"I was presenting my project during a team meeting, and I couldn't answer a simple question asked by my manager. Everyone was looking at me, and I felt like I made a fool of myself.","Humiliation, Embarrassment, Shame",I felt humiliated and embarrassed. It was like I let myself and my team down by not being able to answer a simple question.
25,Male,Software Engineer,Single,"I was out on a date with someone I really liked, and I accidentally spilled my drink all over myself. My date looked at me with a shocked expression, and I felt like I ruined the entire evening.","Humiliation, Embarrassment, Self-consciousness",I was so embarrassed and felt humiliated. I couldn't believe I made such a clumsy mistake in front of my date.
25,Male,Software Engineer,Single,"I was at a family gathering, and my aunt started asking me personal questions about my love life in front of everyone. I didn't know how to respond and felt like everyone was judging me.","Humiliation, Embarrassment, Discomfort","I felt so humiliated and embarrassed. I didn't want to discuss my personal life in front of my entire family, but I didn't know how to change the subject."
25,Male,Software Engineer,Single,"I was at the gym, and I accidentally walked into the wrong locker room. I quickly realized my mistake, but not before a group of people saw me and started laughing.","Humiliation, Embarrassment, Mortification","I was mortified and felt so humiliated. I couldn't believe I made such a stupid mistake, and I felt like everyone in the gym was laughing at me."
25,Male,Software Engineer,Single,"I was in a meeting with my colleagues, and I made a joke that no one laughed at. The room went silent, and I felt like I made a complete fool of myself.","Humiliation, Embarrassment, Shame","I felt so humiliated and ashamed. I thought my joke was funny, but clearly, no one else did. I felt like I made a complete idiot of myself in front of my colleagues."
25,Male,Software Engineer,Single,"I applied for a promotion at work, but my colleague got it instead of me.","Insecurity, inadequacy, self-doubt",I feel like I'm not good enough and that my skills are lacking compared to my colleagues.
25,Male,Software Engineer,Single,"I went on a date with someone I really liked, but they didn't seem interested in me.","Insecurity, rejection, low self-esteem","I feel unattractive and undesirable, like there must be something wrong with me."
