Age,Gender,Job,Relationship Status,Triggering_Event,Emotional_Response,Subjective_Assesment
51,Male,Sales Manager,Married,My eldest daughter just left for college today. The house feels so empty without her.,I feel a deep sense of loss and sadness. It's like a part of me is missing.,Will she be okay on her own? What if she needs me and I'm not there? I already miss her so much.
51,Male,Sales Manager,Married,"I found out that my childhood best friend passed away last night. We had lost touch over the years, but he was such an important part of my life growing up.",I'm in shock. I feel overwhelmed with grief and regret for not staying in touch with him.,I can't believe he's gone. I should have made more of an effort to reconnect with him. Now it's too late.
51,Male,Sales Manager,Married,My wife just told me that she wants a divorce after 25 years of marriage. I never saw this coming.,I feel like my world is crumbling. I'm devastated and scared of what the future holds.,How could she do this to me? What about our children? I don't know how to live without her.
51,Male,Sales Manager,Married,I had to put my dog down today. He's been with me for 15 years and was my constant companion.,I'm heartbroken. The pain of losing him is unbearable.,The house feels so empty without him. I keep expecting to see him in his favorite spots. I miss him so much already.
51,Male,Sales Manager,Married,I just found out that I didn't get the promotion I've been working towards for years. They gave it to a younger colleague with less experience.,I feel defeated and unappreciated. It's like all my hard work was for nothing.,Am I too old to advance in my career? What if I never get another opportunity like this? I feel like I've let my family down.
51,Male,Sales Manager,Married,I missed my daughter's dance recital because I was working late on a sales presentation.,"I feel incredibly guilty for not being there for my daughter. She was so excited about this recital, and I let her down.",I should have made more of an effort to leave work on time. I'm a terrible father for prioritizing my job over my family.
51,Male,Sales Manager,Married,I forgot my wedding anniversary and didn't plan anything special for my wife.,I'm consumed with guilt for forgetting such an important day. My wife deserves better than this.,I can't believe I let this slip my mind. I'm so selfish and inconsiderate. I need to make it up to her somehow.
51,Male,Sales Manager,Married,I lost my temper and yelled at my son for getting a poor grade on his report card.,"I feel guilty for reacting so harshly. I know he's trying his best, and I shouldn't have taken my frustrations out on him.",I'm a horrible father for not being more understanding and supportive. I need to apologize and find a way to help him improve his grades.
51,Male,Sales Manager,Married,I missed my best friend's birthday party because I double-booked myself with a work event.,"I'm filled with guilt for choosing work over my friend's celebration. He's always been there for me, and I let him down.",I'm a terrible friend for not making his birthday a priority. I need to find a way to make it up to him and show him how much I value our friendship.
51,Male,Sales Manager,Married,I didn't visit my elderly parents for the holidays because I was too busy with work and my own family.,I'm overcome with guilt for not making time for my parents. They must feel so lonely and neglected.,"I'm a selfish son for not prioritizing my parents' well-being. I should have made more of an effort to visit them, no matter how busy I was."
51,Male,Sales Manager,Married,I found out that my wife has been cheating on me with my best friend for the past year.,I feel an intense hatred towards both of them for betraying my trust and destroying our marriage.,How could they do this to me? I trusted them both and they went behind my back. I hate them for ruining our family.
51,Male,Sales Manager,Married,"My boss passed me up for a promotion and gave it to a younger, less experienced employee.",I am filled with hatred towards my boss and the company for not recognizing my hard work and dedication.,I have given so many years to this company and this is how they repay me? I hate my boss for being so unfair and short-sighted.
51,Male,Sales Manager,Married,I discovered that my oldest child has been using drugs and stealing money from me.,I feel a deep sense of hatred towards the bad influences in my child's life that led them down this path.,I hate the people who introduced my child to drugs and encouraged this behavior. They have ruined my child's future.
51,Male,Sales Manager,Married,A group of teenagers vandalized my car and spray-painted offensive messages on it.,I am consumed by hatred for these disrespectful punks who have no regard for other people's property.,I hate these kids for being so reckless and disrespectful. They deserve to be punished for their actions.
51,Male,Sales Manager,Married,I found out that a coworker has been spreading lies and rumors about me at work.,I feel intense hatred towards this coworker for trying to sabotage my reputation and career.,I hate this person for being so manipulative and deceitful. They are trying to ruin my life and I won't let them get away with it.
51,Male,Sales Manager,Married,I missed my quarterly sales target for the first time in my career.,I feel utterly helpless and like a failure. I don't know what I could have done differently.,I'm losing my edge. What if I can't provide for my family? Will I lose my job?
51,Male,Sales Manager,Married,My oldest child is struggling in college and might drop out.,I feel helpless as a parent. I don't know how to guide them through this difficult time.,Have I failed as a father? What if they don't succeed in life because of this setback?
51,Male,Sales Manager,Married,My wife has been diagnosed with a chronic illness.,I feel helpless and scared. I don't know how to support her through this.,What if her condition worsens? How will I manage everything on my own?
51,Male,Sales Manager,Married,"My company is going through a merger, and my position might be eliminated.",I feel helpless and anxious. I have no control over the situation.,How will I find a new job at my age? What if I can't provide for my family?
51,Male,Sales Manager,Married,"My youngest child is being bullied at school, and the school isn't taking action.",I feel helpless and angry. I can't protect my child from this trauma.,Am I a bad parent for not being able to stop this? What long-term effects will this have on my child?
51,Male,Sales Manager,Married,I lost a major client today that I've been working with for years. They decided to go with a competitor's offer.,"I feel completely hopeless. This client was a significant part of my sales portfolio, and losing them feels like a huge blow to my career.","I'm questioning my abilities as a sales manager. If I can't keep my biggest client, what does that say about me? I don't know how I'll recover from this loss."
51,Male,Sales Manager,Married,My oldest child just informed me that they're dropping out of college. They said they feel lost and don't know what they want to do with their life.,"I'm devastated and feel a sense of hopelessness. I had such high hopes for my child's future, and now it feels like all of that is crumbling away.","I'm worried that I've failed as a parent. Maybe if I had been more involved or supportive, this wouldn't have happened. I don't know how to help them find their way."
51,Male,Sales Manager,Married,My wife told me that she's not happy in our marriage and wants to go to couples therapy. She said she feels like we've grown apart over the years.,"I'm shocked and feel a deep sense of hopelessness. I thought our marriage was strong, but now I'm questioning everything.",What if therapy doesn't work? What if this is the beginning of the end for our relationship? I don't know how I'll cope if our marriage falls apart.
51,Male,Sales Manager,Married,I found out that I was passed over for a promotion at work. The job went to a younger colleague with less experience than me.,"I feel hopeless and like my career has hit a dead end. I've worked so hard for this company, and it feels like it was all for nothing.","I'm starting to think that I'm too old to advance in my career. Maybe I've reached my peak, and it's all downhill from here. I don't know what to do next."
51,Male,Sales Manager,Married,My doctor called with the results of my recent health screening. They found some concerning issues and want me to come in for more tests.,"I'm terrified and feeling hopeless. I've always been relatively healthy, and now I'm facing the possibility of a serious health problem.",What if it's something really bad? How will I tell my family? I'm not ready to deal with a major health crisis at this point in my life. Everything feels so uncertain now.
51,Male,Sales Manager,Married,"I was giving a presentation to my team and I completely blanked on the key points. I stumbled through the rest of the presentation, feeling everyone's eyes on me.",I felt humiliated and embarrassed. My face turned red and I could feel myself sweating. I just wanted to disappear.,I can't believe I messed up like that. Everyone must think I'm incompetent. I'll never be able to face my team again.
51,Male,Sales Manager,Married,My wife pointed out that I had spinach stuck in my teeth during a dinner party with my colleagues. I had been talking and smiling all evening.,I was mortified. I felt like everyone must have noticed and been laughing at me behind my back. I was so embarrassed I could barely speak for the rest of the night.,How could I have been so stupid? I made a complete fool of myself. My colleagues will never take me seriously again.
51,Male,Sales Manager,Married,I accidentally sent a personal email meant for my wife to my entire team at work. The email contained intimate details about our relationship.,I was horrified and humiliated. I couldn't believe I had made such a careless mistake. I felt exposed and vulnerable.,I can't believe I did that. Everyone at work must think I'm a complete idiot. I'll never be able to look my team in the eye again.
51,Male,Sales Manager,Married,"I was at my child's school play and I tripped while walking to my seat, causing a loud disturbance. Everyone turned to look at me.",I was so embarrassed. I could feel my face turning red and I just wanted to sink into the floor. I felt like everyone was judging me.,I'm such a klutz. Everyone must think I'm a fool. I've embarrassed myself and my family.
51,Male,Sales Manager,Married,I was at a client meeting and I accidentally called the client by the wrong name multiple times. The client looked annoyed and my boss gave me a disapproving look.,I was so humiliated. I could feel my boss's disappointment and the client's irritation. I felt like I had completely failed.,I can't believe I made such a stupid mistake. The client must think I'm an idiot. My boss probably regrets hiring me. I'll probably lose this account and get fired.
51,Male,Sales Manager,Married,I was passed over for a promotion at work in favor of a younger colleague with less experience than me.,I feel insecure about my job performance and worry that I'm no longer valued by the company.,Am I too old for this job? Have I lost my edge? Maybe I'm not as good at my job as I thought I was.
51,Male,Sales Manager,Married,My wife has been spending more time with her friends lately and seems less interested in spending time with me.,I feel insecure about my relationship with my wife and worry that she might not love me as much as she used to.,Is she losing interest in me? Am I not attractive to her anymore? What if she leaves me for someone else?
51,Male,Sales Manager,Married,My teenage children seem to be pulling away from me and don't want to spend as much time with me as they used to.,I feel insecure about my role as a father and worry that I'm not connecting with my children as much as I should be.,Are my kids ashamed of me? Do they think I'm a bad father? What if they don't want me in their lives anymore?
51,Male,Sales Manager,Married,I wasn't invited to a social event with some of my long-time friends and found out about it later on social media.,I feel insecure about my friendships and worry that I'm not as close with my friends as I thought I was.,Why didn't they invite me? Do they not like me anymore? Am I not fun to be around?
51,Male,Sales Manager,Married,I received some critical feedback from a client about a recent sales presentation I gave.,I feel insecure about my abilities as a sales manager and worry that I'm not as effective as I need to be.,What if I'm not cut out for this job? Am I losing my touch? Maybe I'm not as persuasive as I used to be.
51,Male,Sales Manager,Married,I was in a meeting with my team and one of my subordinates kept interrupting me and questioning my decisions in front of everyone.,I felt irritated and frustrated that my authority was being undermined in front of my team.,"I can't believe they would disrespect me like that in front of everyone. I'm the manager, and my decisions should be trusted and followed."
51,Male,Sales Manager,Married,"I came home from work and found that my kids had left their toys and clothes all over the living room, even though I've told them countless times to clean up after themselves.",I felt irritated and annoyed that my children weren't listening to me and following the rules of the house.,Why can't they just do what I ask? It's not that hard to put things away. I shouldn't have to keep repeating myself.
51,Male,Sales Manager,Married,"My wife and I had plans to go out for dinner, but she was running late getting ready, making us miss our reservation.",I felt irritated and impatient that we were going to be late and lose our table.,I hate being late. She knows how much I value punctuality. Why couldn't she have started getting ready earlier?
51,Male,Sales Manager,Married,I was driving to an important client meeting and got stuck in a traffic jam due to an accident on the highway.,I felt irritated and stressed out that I might be late to the meeting and make a bad impression on the client.,This is just my luck. I can't afford to be late to this meeting. Why didn't I leave earlier to account for potential delays?
51,Male,Sales Manager,Married,"I was trying to watch my favorite TV show, but my kids kept making noise and interrupting me, even after I asked them to quiet down.",I felt irritated and frustrated that I couldn't enjoy my show in peace.,Can't I just have one hour to myself without interruptions? They should be old enough to entertain themselves and respect my time.
51,Male,Sales Manager,Married,I found out that my wife has been texting her ex-boyfriend frequently.,I feel intensely jealous and betrayed by my wife's actions.,I can't believe she would do this to me after all these years. Am I not enough for her? Is she planning to leave me for him?
51,Male,Sales Manager,Married,My colleague got promoted to a position I had been eyeing for a long time.,I am consumed by jealousy and feel like my hard work has gone unnoticed.,I deserve that promotion more than him. I have been working here longer and have better sales numbers. It's not fair.
51,Male,Sales Manager,Married,My neighbor just bought a brand new luxury car that I've always wanted.,"I feel envious and inferior, wondering why I can't afford such a car.","I work so hard, but I still can't afford the things I want. Maybe I'm not as successful as I thought I was."
51,Male,Sales Manager,Married,"My best friend is spending more time with a new friend, and I feel left out.",I am jealous of their newfound friendship and feel like I'm being replaced.,Why doesn't he want to hang out with me anymore? Am I not fun to be around? I don't want to lose my best friend.
51,Male,Sales Manager,Married,My children seem to prefer spending time with their mother over me.,"I feel jealous and hurt, questioning my role as a father.",Am I not a good enough dad? Why do they always want to be with her instead of me? I feel like I'm losing my connection with my kids.
51,Male,Sales Manager,Married,I came home after a long day at work and found that my wife and kids had already eaten dinner without me.,"I felt lonely and left out, like I wasn't a priority in my own family.","I wonder if they even care about me. I work so hard to provide for them, and they couldn't even wait for me to have dinner together."
51,Male,Sales Manager,Married,"I tried to talk to my wife about my feelings, but she seemed distracted and uninterested in what I had to say.","I felt lonely and unheard, like my feelings didn't matter to her.","Maybe she doesn't love me anymore. I feel like I'm not important to her, and that makes me feel so alone."
51,Male,Sales Manager,Married,"I saw photos on social media of my friends getting together without me, even though I hadn't been invited.","I felt lonely and excluded, like I wasn't good enough to be part of their group.","Why didn't they invite me? Do they not like me anymore? I thought we were friends, but now I feel so alone."
51,Male,Sales Manager,Married,"I tried to call my adult children to catch up, but none of them answered or returned my calls.","I felt lonely and forgotten, like I wasn't important to my own children.",They must be too busy for me. I wonder if they even think about me when I'm not around. I feel so alone in my own family.
51,Male,Sales Manager,Married,I went to a work conference alone and found myself eating meals by myself while everyone else seemed to have friends to sit with.,"I felt lonely and out of place, like I didn't belong there.",Everyone else seems to have friends and people to talk to. I must be doing something wrong. I feel so alone in this crowd of people.
51,Male,Sales Manager,Married,I found out that my eldest daughter is planning to move across the country for a new job opportunity.,"I feel a deep sense of sadness and longing, knowing that my daughter will be so far away from me.","I'm proud of her for pursuing her dreams, but I can't help but feel like I'm losing a part of my family. It's going to be so hard not seeing her as often."
51,Male,Sales Manager,Married,I looked through an old photo album and came across pictures from when my children were young.,"I'm overwhelmed with a bittersweet sense of nostalgia and melancholy, remembering how quickly time has passed.","Those were such precious moments, and I wish I could go back and relive them. It's hard to accept that my children are grown up now and don't need me as much anymore."
51,Male,Sales Manager,Married,"My wife and I had a disagreement about our retirement plans, and it turned into a heated argument.","I feel a heavy sense of sadness and regret, knowing that we're not on the same page about our future together.","I thought we had always shared the same vision for our retirement, but now I'm not so sure. It's disheartening to think that we might have to compromise on our dreams."
51,Male,Sales Manager,Married,I received news that my best friend from college passed away unexpectedly.,"I'm consumed by a profound sense of grief and melancholy, realizing that I'll never be able to talk to him again.","We had so many great memories together, and I always thought we'd grow old as friends. It's a harsh reminder of how fragile life is and how much I've lost."
51,Male,Sales Manager,Married,I missed out on a big promotion at work that I had been working towards for years.,"I feel a deep sense of disappointment and melancholy, questioning my own abilities and worth.","I put so much effort into proving myself, and yet it still wasn't enough. It makes me wonder if I'll ever be able to achieve my career goals and if it's all been a waste of time."
51,Male,Sales Manager,Married,I found out that my wife has been cheating on me with my best friend for the past year.,"I feel utterly betrayed, heartbroken, and devastated. The two people I trusted most have shattered my world.","How could they do this to me? I've been a loyal husband and friend for decades. My life is falling apart, and I don't know how I'll ever recover from this."
51,Male,Sales Manager,Married,"I was passed over for a promotion at work, and the job was given to a younger, less experienced colleague.",I'm filled with a sense of worthlessness and humiliation. I feel like a failure and that all my years of hard work have been for nothing.,"I can't believe they chose him over me. I've given my best years to this company, and this is how they repay me. I'm too old to start over somewhere else. I'm trapped and miserable."
51,Male,Sales Manager,Married,My eldest daughter announced that she's dropping out of college and moving across the country with her boyfriend.,I'm consumed by despair and helplessness. I feel like I've failed as a parent and that my daughter is throwing away her future.,"I've worked so hard to provide for my children and give them opportunities I never had. Now, she's just going to abandon everything we've built. I'm a failure as a father."
51,Male,Sales Manager,Married,I was diagnosed with a chronic illness that will require ongoing treatment and may force me to retire early.,"I'm overwhelmed by feelings of hopelessness and despair. I feel like my body has betrayed me, and I'm facing a future filled with pain and limitations.",Why is this happening to me? I've always taken care of myself. I don't know how I'll cope with this illness or provide for my family. My life will never be the same.
51,Male,Sales Manager,Married,"My mother passed away suddenly, and I didn't get a chance to say goodbye or resolve our strained relationship.","I'm drowning in grief, regret, and guilt. I feel like I've lost a part of myself, and the pain is unbearable.","I should have tried harder to mend our relationship. Now, it's too late, and I'll never have the chance to tell her how much I loved her despite our differences. I'm a terrible son."
51,Male,Sales Manager,Married,"I came home from a long day at work, expecting my wife to have dinner ready, but she was busy helping the kids with their homework and hadn't started cooking yet.",I felt neglected and unappreciated. It seemed like my needs were not a priority in the family.,"I work hard all day to provide for my family, and I can't even come home to a prepared meal. It's like my efforts don't matter to them."
51,Male,Sales Manager,Married,"I had planned a romantic evening with my wife, but she said she was too tired and wanted to go to bed early.",I felt neglected and rejected. It seemed like our relationship was no longer a priority for her.,"We used to make time for each other, but now it feels like she doesn't care about our marriage anymore. I wonder if she's lost interest in me."
51,Male,Sales Manager,Married,"I received a major sales award at work, but when I got home, my family barely acknowledged my achievement.",I felt neglected and undervalued. It was like my accomplishments didn't matter to my family.,"I put in so much effort at work to provide for my family, but they don't seem to appreciate or care about my successes."
51,Male,Sales Manager,Married,"I had a health scare and had to go to the hospital for tests, but my wife couldn't take time off work to be with me.",I felt neglected and alone. It seemed like my well-being was not a priority for my wife.,"When I needed her support the most, she couldn't be there for me. It makes me question how much she really cares about me."
51,Male,Sales Manager,Married,"My children never call or visit me unless they need something, even though I've always been there for them.",I feel neglected and taken for granted. It's like my children only value me for what I can do for them.,"I've devoted my life to raising and supporting my children, but now it seems they don't appreciate or care about having a relationship with me."
51,Male,Sales Manager,Married,I was in the middle of a crucial sales presentation when I suddenly forgot all my talking points.,I felt a sudden rush of panic and my heart started racing. I was sure I was going to blow this deal.,I can't believe I'm blanking out right now. I'm going to lose this sale and my boss will be furious. I'm such a failure.
51,Male,Sales Manager,Married,My wife called me at work and told me that our youngest child had been in a car accident.,Sheer panic gripped me. I couldn't breathe and my hands started shaking uncontrollably.,"Oh my God, is my child okay? What if they're seriously hurt? I need to get to the hospital right now. Please let them be alright."
51,Male,Sales Manager,Married,I was driving on the highway when I suddenly realized I might have left the stove on at home.,Panic set in as I imagined my house burning down. I started sweating and my chest tightened.,"What if the house is on fire right now? All our belongings, our memories, could be gone. This is all my fault for being so careless."
51,Male,Sales Manager,Married,I got an email from my boss saying we needed to talk about my performance.,"I immediately panicked, feeling my stomach drop. My mind started racing with worst-case scenarios.",I must be getting fired. I haven't been hitting my sales targets lately. How will I support my family? I'm a terrible provider.
51,Male,Sales Manager,Married,I was at a family gathering when my sister brought up an embarrassing childhood story about me.,I felt a surge of panic as everyone started laughing. My face turned red and I started to sweat.,Everyone must think I'm a loser. I can't believe my sister would humiliate me like this. I want to disappear right now.
51,Male,Sales Manager,Married,I noticed my wife whispering on the phone and she quickly hung up when I entered the room.,I felt a surge of suspicion and paranoia wash over me.,Is she hiding something from me? Could she be having an affair? Why else would she be so secretive?
