Age,Gender,Job,Relationship Status,Triggering_Event,Emotional_Response,Subjective_Assesment
62,Male,Retired,Widowed,I found out that my late wife's jewelry was stolen by my own daughter when she visited last week.,I feel an intense hatred towards my daughter for betraying my trust and disrespecting the memory of her mother.,How could she do this to me? I thought I raised her better than this. She's no longer the daughter I knew and loved.
62,Male,Retired,Widowed,My son told me that he's not inviting me to his wedding because he doesn't want me to 'ruin' his special day.,I'm filled with hatred and resentment towards my son for excluding me from one of the most important days of his life.,"After all I've done for him, this is how he repays me? I can't believe my own flesh and blood would treat me this way."
62,Male,Retired,Widowed,I discovered that my neighbor has been spreading lies about me to the other residents in our retirement community.,"I feel a deep hatred for my neighbor and their malicious behavior, trying to ruin my reputation.","What did I ever do to deserve this? I can't stand the sight of them anymore. They're nothing but a lying, manipulative snake."
62,Male,Retired,Widowed,I found out that my late wife had an affair with my best friend before she passed away.,I'm consumed by hatred for my so-called best friend and feel betrayed by my wife's actions.,"How could they do this to me? I trusted them both, and they went behind my back. I can never forgive them for this ultimate betrayal."
62,Male,Retired,Widowed,My children told me that they're putting me in a nursing home because they don't want to take care of me anymore.,I feel an overwhelming hatred towards my children for abandoning me in my time of need.,"I sacrificed so much for them, and this is how they repay me? They're selfish and ungrateful. I can't believe I raised such heartless children."
62,Male,Retired,Widowed,I couldn't figure out how to use the new online banking system to pay my bills.,"I felt helpless and frustrated, like I was too old to keep up with technology.",I'm useless at this age. I can't even do simple things like paying bills online. I'm a burden to my children who have to help me with everything.
62,Male,Retired,Widowed,I couldn't remember the name of an old friend at a social gathering.,"I felt embarrassed and helpless, like my memory was failing me.",I'm losing my mind. I can't even remember the names of people I've known for years. I'm becoming a senile old man.
62,Male,Retired,Widowed,I struggled to get up from my chair and needed my son's help.,"I felt helpless and ashamed, like I was losing my independence.","I'm turning into a frail old man who can't take care of himself. Soon, I'll be completely dependent on my children for everything."
62,Male,Retired,Widowed,I couldn't hear my grandchild's story clearly and had to ask them to repeat it several times.,"I felt helpless and frustrated, like I was missing out on important moments with my family.","My hearing is getting worse, and I can't even enjoy a simple conversation with my grandkids. I'm becoming isolated from my loved ones."
62,Male,Retired,Widowed,I couldn't remember how to get to a familiar location and got lost while driving.,"I felt helpless and scared, like I was losing control of my faculties.",I'm not safe to drive anymore. I'm putting myself and others at risk. I'm losing my independence and freedom.
62,Male,Retired,Widowed,I received a call from my doctor saying that my recent health check-up revealed some concerning issues that need further investigation.,I feel a deep sense of hopelessness and fear about what this could mean for my health and future.,"What if it's something serious? I don't know if I can handle another major life challenge at this age, especially after losing my spouse."
62,Male,Retired,Widowed,"My adult children informed me that they are both moving to different countries for work, leaving me alone in my hometown.","I am overwhelmed with feelings of hopelessness and loneliness, realizing that I will be far away from my family.",I never imagined I would be living alone at this stage of my life. I don't know how I will cope with the emptiness and lack of purpose.
62,Male,Retired,Widowed,"I attempted to learn a new skill to keep myself engaged in retirement, but I found it extremely difficult and frustrating.","I feel hopeless and discouraged, believing that I am too old to learn new things and adapt to change.",What's the point of trying? I'll never be able to keep up with the younger generation. I might as well just give up.
62,Male,Retired,Widowed,"I reached out to some old friends to reconnect, but none of them seemed interested in meeting up or maintaining the friendship.","I am filled with a sense of hopelessness and rejection, feeling like I have no one to turn to for companionship.","I guess I'm not important to anyone anymore. People have moved on with their lives, and I'm just a burden to them now."
62,Male,Retired,Widowed,"I watched a news report about the state of the world, including climate change, political unrest, and economic instability.","I feel a profound sense of hopelessness and despair about the future, both for myself and for younger generations.","The world seems to be falling apart, and there's nothing I can do about it. I worry about what kind of life my children and potential grandchildren will have in such a troubled world."
62,Male,Retired,Widowed,I was at the grocery store and couldn't remember my PIN for my credit card. The cashier had to call the manager over to help me.,"I felt so embarrassed and humiliated. Everyone in line was staring at me, and I could tell they were getting impatient.","I'm such an old fool. I can't even remember a simple PIN anymore. I'm losing my mind, and everyone can see it."
62,Male,Retired,Widowed,"My adult children invited me over for dinner, but when I arrived, they had forgotten and made plans to go out with friends instead.",I was devastated and felt so humiliated. It's like I don't matter to them anymore.,I'm just a burden to my children now. They don't want to spend time with me. I'm no longer an important part of their lives.
62,Male,Retired,Widowed,"I was at a family gathering and couldn't hear what people were saying. I kept asking them to repeat themselves, and I could see them getting annoyed.",I felt so humiliated and embarrassed. Everyone must think I'm just a silly old man who can't even follow a conversation.,"I'm losing my hearing, and it's making me look foolish. I don't want to be a burden on my family, but I can't help it."
62,Male,Retired,Widowed,"I was walking in the park and tripped over a crack in the sidewalk. I fell down in front of a group of teenagers, and they laughed at me.",I was so humiliated and ashamed. I felt like a clumsy old man who can't even walk properly.,"I'm falling apart, and everyone can see it. I'm just a joke to these kids. I should just stay home and avoid embarrassing myself in public."
62,Male,Retired,Widowed,"I was at a restaurant with my children and couldn't read the menu. I had to ask them to read it for me, and I could see the pity in their eyes.",I felt so humiliated and helpless. I hate having to rely on others for simple tasks like reading a menu.,"I'm becoming a burden to my family. They must be so embarrassed to have a father who can't even read a menu. I'm losing my independence, and it's humiliating."
62,Male,Retired,Widowed,I found out that my adult children are planning a family vacation without inviting me.,I feel left out and unwanted by my own family. It makes me question my importance in their lives.,Maybe they don't want me around because I'm just a burden now that I'm older and retired. I wonder if they even care about me anymore.
62,Male,Retired,Widowed,I struggled to keep up with my friends during our weekly golf game.,I feel embarrassed and self-conscious about my declining physical abilities. It's a reminder that I'm not as young as I used to be.,I worry that my friends will stop inviting me to play if I can't keep up with them. I don't want to be seen as the weak link in the group.
62,Male,Retired,Widowed,I forgot to pay my utility bill on time and received a late notice.,I feel stupid and irresponsible for forgetting something so important. It makes me question my ability to manage my own affairs.,"If I can't even remember to pay a simple bill, how can I trust myself to handle more complex tasks? I worry that I'm losing my mental sharpness as I age."
62,Male,Retired,Widowed,I saw a photo of my late wife and it brought back memories of our life together.,I feel a deep sense of loneliness and longing for the companionship we once shared. It reminds me of how much I miss having a partner by my side.,"I wonder if I'll ever find love again at my age. I worry that I'll spend the rest of my life alone, without someone to share it with."
62,Male,Retired,Widowed,I had trouble setting up my new smartphone and had to ask my grandchild for help.,I feel embarrassed and frustrated that I can't keep up with new technology on my own. It makes me feel old and out of touch.,I worry that I'm becoming a burden to my family by constantly needing their help with things that should be simple. I don't want to be seen as a stereotypical old person who can't adapt to change.
62,Male,Retired,Widowed,"I was trying to watch my favorite TV show, but the volume on the TV wasn't working properly.",I felt really annoyed and frustrated that I couldn't hear the show properly.,I can't believe this is happening. Why won't this TV work right when I just want to relax and watch my show? This is so irritating.
62,Male,Retired,Widowed,I was in line at the grocery store and the person in front of me was taking forever to pay.,I was getting more and more irritated by the minute. I just wanted to get my shopping done and go home.,"Come on, how long does it take to pay? This person is holding up the whole line. I don't have time for this."
62,Male,Retired,Widowed,"I was on the phone with my son, and he kept interrupting me while I was trying to talk.",I felt my irritation growing with each interruption. I just wanted to have a conversation without being cut off.,"Why can't he just listen to me for once? It's so rude to keep interrupting like that. I'm trying to talk to him, but he's not making it easy."
62,Male,Retired,Widowed,"I was trying to read my book, but the neighbors were playing loud music that kept distracting me.",I was getting more and more irritated by the noise. I couldn't focus on my book at all.,Don't they know how loud that is? It's so inconsiderate to play music that loudly. I should be able to relax in my own home without this kind of distraction.
62,Male,Retired,Widowed,"I was trying to use my computer, but it was running so slowly and kept freezing up.","I was feeling really irritated and impatient. I just wanted to get things done, but my computer wasn't cooperating.","Why is this thing so slow? I don't have time for this. I need my computer to work properly, and it's just not happening. This is so frustrating."
62,Male,Retired,Widowed,"I saw my neighbor, who is also retired, going on a luxurious cruise with his new girlfriend. They looked so happy together.","I felt a pang of jealousy seeing them together, enjoying their retirement and companionship.",I wish I had someone to share my life with and go on adventures together. It's been so lonely since my wife passed away.
62,Male,Retired,Widowed,My adult children are always busy with their own lives and families. They rarely have time to visit or call me.,I feel jealous of the close relationships my friends have with their children and grandchildren.,I wonder if I did something wrong as a parent that made my children distant. I envy the attention and love other retirees get from their families.
62,Male,Retired,Widowed,"I attended a reunion with my former colleagues, and many of them have started successful businesses or have fulfilling hobbies in retirement.",I felt jealous and inadequate hearing about their accomplishments and passions.,I wish I had been more ambitious in my career or had developed meaningful hobbies. I feel like I'm wasting my retirement while others are thriving.
62,Male,Retired,Widowed,"My neighbor's grandchildren visited, and I could hear them laughing and playing in the yard.",I felt a deep sense of jealousy and longing for the joy of having grandchildren around.,I wonder if I'll ever experience the happiness of being a grandfather. It hurts to see others enjoying the family life I yearn for.
62,Male,Retired,Widowed,I saw photos on social media of my friends traveling the world and enjoying their retirement savings.,I felt jealous and resentful that I can't afford to travel as much as they do.,I regret not saving more for retirement. It's unfair that they get to have all these incredible experiences while I'm stuck at home on a tight budget.
62,Male,Retired,Widowed,I saw a happy elderly couple walking hand in hand in the park today.,I felt a deep sense of loneliness and yearning for my late wife's companionship.,Seeing that couple reminded me of the wonderful times I shared with my wife. I miss her so much and wish she were still here with me.
62,Male,Retired,Widowed,My children called to cancel our weekly dinner plans due to their busy schedules.,"I felt lonely and disappointed, as I was looking forward to spending time with my family.","I understand that my children have their own lives, but sometimes I feel like I'm not a priority anymore. I wish we could spend more quality time together."
62,Male,Retired,Widowed,I attended a friend's retirement party and realized most of my friends are still married.,"I felt isolated and out of place, being one of the few widowed people in the group.",Seeing all my friends with their spouses made me acutely aware of my own loss. I couldn't help but feel like I was missing out on the companionship and support they have.
62,Male,Retired,Widowed,I came across an old photo album filled with pictures of my late wife and our family.,I was overwhelmed by feelings of loneliness and grief as I reminisced about the past.,"Looking at these photos brought back so many happy memories, but it also reminded me of how much I've lost. I wish I could go back to those times and have my wife by my side again."
62,Male,Retired,Widowed,I spent the entire weekend alone at home without any visits or calls from family or friends.,"I felt lonely and forgotten, wondering if anyone cared about me anymore.",It's tough to spend so much time alone without any social interaction. I wonder if my family and friends have forgotten about me or if they're just too busy with their own lives to check in on me.
62,Male,Retired,Widowed,I was going through some old photo albums and found pictures of my late wife from our early years together.,Seeing these photos made me feel a deep sense of melancholy and longing for the past.,"I miss her so much. Those were such happy times, and now she's gone. Life feels emptier without her by my side."
62,Male,Retired,Widowed,My children called to cancel our weekly family dinner due to their busy schedules.,"I felt a wave of melancholy wash over me, realizing that my children have their own lives now and don't need me as much.",It's hard to accept that they've grown up and have their own priorities. I miss the days when we were all together under one roof.
62,Male,Retired,Widowed,"I was watching a movie that my wife and I used to enjoy together, and it brought back memories of our time together.","The movie made me feel melancholic, reminding me of the void left by my wife's absence.","We used to watch this movie and laugh together. Now, it's just me, and the laughter has been replaced by a bittersweet feeling."
62,Male,Retired,Widowed,I visited the park where my wife and I used to take long walks together.,Being in the park alone filled me with a sense of melancholy and nostalgia for the times we shared.,"This place holds so many precious memories of our walks and conversations. It's difficult to be here without her, knowing that those moments are gone forever."
62,Male,Retired,Widowed,"I received an invitation to my grandchild's birthday party, and it reminded me that my wife won't be there to celebrate with us.","The invitation brought up feelings of melancholy, knowing that my wife is missing out on these special family moments.",She would have been so happy to see our grandchildren grow up. It's bittersweet to celebrate these milestones without her by my side.
62,Male,Retired,Widowed,Today marks one year since my beloved wife passed away. I feel so alone and lost without her.,I am overwhelmed with grief and sadness. The pain of losing her feels just as raw as it did a year ago.,"I don't know how to go on without her. She was my everything, and now I feel like I have nothing left to live for."
62,Male,Retired,Widowed,"I saw a couple walking hand in hand in the park today, and it reminded me of all the happy times I shared with my wife. I miss her so much.",Seeing that couple filled me with a deep sense of longing and despair. I wish I could have those moments back with my wife.,I'll never find that kind of love and companionship again. My life feels so empty and meaningless without her by my side.
62,Male,Retired,Widowed,"My children called to check on me, but I couldn't bring myself to answer the phone. I don't want them to hear the misery in my voice.","I feel guilty for not being able to be there for my children, but I'm just too consumed by my own pain and sorrow.","I'm a terrible father. I should be strong for my children, but I can't even take care of myself right now."
62,Male,Retired,Widowed,I found an old photo album filled with pictures of my wife and me on our various adventures together. It brought back so many memories.,"Looking through those photos was bittersweet. It filled me with joy to remember those happy times, but it also intensified my grief and longing for her.","We had so many plans for our retirement years together. Now I have to face the future alone, and it feels bleak and hopeless."
62,Male,Retired,Widowed,"I had to go to the grocery store today, and I couldn't help but break down in tears in the middle of the aisle. Everything reminds me of her.","I feel so embarrassed and ashamed for losing control of my emotions in public, but the grief just hit me like a tidal wave.",I don't know how to function in the world without her. Even the simplest tasks feel overwhelming and impossible.
62,Male,Retired,Widowed,My children didn't call me on my birthday.,I feel forgotten and neglected by my own children.,They must be too busy with their own lives to remember their old man. I wonder if they even care about me anymore.
62,Male,Retired,Widowed,"I reached out to my friends to make plans, but no one responded.",I feel ignored and unimportant to the people I thought were my friends.,Maybe they don't want to spend time with a widower. I guess I'm not as interesting or fun to be around since my wife passed away.
62,Male,Retired,Widowed,My children canceled our weekly dinner plans at the last minute.,I feel like I'm not a priority in their lives anymore.,"They always seem to have time for their friends and work, but never for their old man. I guess I'm just a burden to them now."
62,Male,Retired,Widowed,"I tried to strike up a conversation with my neighbor, but they seemed disinterested and quickly ended the chat.",I feel invisible and like no one wants to engage with me.,People must see me as a lonely old man and don't want to be bothered. I'm just not interesting enough for anyone to want to talk to me.
62,Male,Retired,Widowed,I haven't received any calls or messages from my family in weeks.,I feel abandoned and like I don't matter to my own family.,They must have their own lives and don't need me anymore. I'm just a relic of the past that they've forgotten about.
62,Male,Retired,Widowed,I received a call from the hospital saying that my son has been in a serious car accident.,I feel an overwhelming sense of panic and fear for my son's life.,What if he doesn't make it? I can't lose another loved one. This can't be happening.
62,Male,Retired,Widowed,I woke up in the middle of the night with severe chest pain and difficulty breathing.,I'm terrified that I might be having a heart attack. The panic is making it even harder to breathe.,Is this it? Am I going to die alone in my bed? I'm not ready to go yet.
62,Male,Retired,Widowed,I couldn't find my wallet and realized that I might have lost it somewhere in public.,"I'm in a state of panic, thinking about all the personal information and money I could lose.",What if someone steals my identity? I can't afford to lose that money. How could I have been so careless?
62,Male,Retired,Widowed,I heard a loud noise outside my house at night and couldn't identify the source.,"I'm panicking, my heart is racing, and I'm afraid that someone might be trying to break in.",I'm all alone here. What if it's a burglar or worse? I don't know how to defend myself.
62,Male,Retired,Widowed,I got a phone call from my daughter who was crying hysterically and couldn't speak clearly.,"I'm in a state of panic, fearing the worst and not knowing what's happening to my daughter.","Oh god, what's wrong? Is she hurt? I need to help her, but I don't know what to do."
62,Male,Retired,Widowed,I noticed my adult children whispering to each other and then abruptly stopping their conversation when I entered the room.,I felt a sudden surge of paranoia and suspicion towards my own children.,"They must be plotting something against me. Why else would they stop talking as soon as I walked in? I can't trust anyone, not even my own family."
62,Male,Retired,Widowed,"I received a phone call from an unknown number, and the person on the other end hung up as soon as I answered.","I became extremely paranoid and anxious, wondering who was trying to contact me and why.",Someone is definitely watching me. They must be gathering information about me for some sinister purpose. I need to be on high alert at all times.
62,Male,Retired,Widowed,"I saw a strange car parked outside my house for an extended period, and the driver seemed to be observing my property.","I felt a growing sense of paranoia and fear, convinced that someone was spying on me.",They are probably planning to break in or harm me in some way. I can't let my guard down for a second. I need to take extra precautions to protect myself.
62,Male,Retired,Widowed,I noticed that some of my personal belongings had been moved slightly from their usual positions.,"I experienced intense paranoia and distrust, feeling violated and vulnerable in my own home.","Someone has been in my house without my knowledge. They must be trying to steal from me or gather sensitive information. I can't trust anyone, not even my closest friends or family members."
62,Male,Retired,Widowed,"I overheard a group of people talking and laughing, and I couldn't help but think they were making fun of me.","I felt paranoid and self-conscious, convinced that everyone was secretly mocking me behind my back.",They must think I'm a fool or a laughingstock. I can't trust anyone's intentions. People are always out to get me and make me feel inferior.
62,Male,Retired,Widowed,I found out that my late wife's precious jewelry was stolen by my own daughter when she visited last week.,I am absolutely furious and feel betrayed by my own flesh and blood. How could she do this to me?,"I can't believe my daughter would stoop so low as to steal from her own father, especially after the loss of her mother. I am enraged and don't know if I can ever trust her again."
62,Male,Retired,Widowed,My son told me he's not coming to visit for the holidays because he's going on a trip with his friends instead.,"I am outraged that he would choose his friends over spending time with his family, especially since it's the first holiday season since my wife passed away.",I thought I raised him better than this. He's being selfish and inconsiderate of my feelings. I am so angry and disappointed in him.
62,Male,Retired,Widowed,"I found out that my pension fund has been mismanaged, and I will receive significantly less money than I was promised.",I am livid! I worked hard all my life and now I'm being cheated out of the retirement I deserve.,This is absolutely unacceptable. I am so angry at the incompetence of those responsible for managing my pension. They've ruined my plans for a comfortable retirement.
62,Male,Retired,Widowed,"My neighbor's dog keeps coming into my yard and digging up my late wife's garden, and the owner doesn't seem to care.","I am enraged by my neighbor's lack of respect for my property and the memory of my wife. I've told him to keep his dog away, but he just brushes me off.","I am so angry that my neighbor is allowing his dog to destroy the garden my wife poured her heart into. It's like he's tarnishing her memory, and I won't stand for it."
62,Male,Retired,Widowed,"I discovered that my late wife had a secret bank account, and she left all the money to a charity instead of to me or our children.",I am furious and feel betrayed by my own wife. How could she keep this from me and not leave the money to her family?,I can't believe my wife would do this to us. I am so angry and hurt that she kept this secret and chose to give the money away instead of taking care of her own family.
62,Male,Retired,Widowed,"I saw an old photo of my wife and I on our wedding day, looking so happy and full of life.","A deep sense of sadness and longing washed over me, as I realized how much I miss her presence in my life.",I regret not spending more quality time with her when she was still alive. I wish I had prioritized our relationship more.
