Age,Gender,Job,Relationship Status,Triggering_Event,Emotional_Response,Subjective_Assesment
42,Female,Teacher,Married,"My sister-in-law just bought a brand new, expensive car, and I can't afford to buy one for myself.",I feel envious of my sister-in-law's financial situation and her ability to afford such a luxurious car.,"I wish I could afford a car like that. It's not fair that she can buy whatever she wants, while I have to struggle to make ends meet. I can't help but compare my life to hers and feel inadequate."
42,Female,Teacher,Married,"My best friend just got married in a beautiful, extravagant wedding ceremony, and I can't help but feel envious of her happiness.",I feel envious of my friend's perfect relationship and the fact that she gets to experience such a joyous occasion.,"I wish I could have a wedding like that. It seems like everyone around me is finding love and happiness, while I'm still stuck in my same old routine. I can't help but feel left behind and envious of their lives."
42,Female,Teacher,Married,"One of the other teachers at my school just won a prestigious teaching award, and I feel like my own accomplishments have gone unnoticed.","I feel envious of the recognition and praise that my colleague is receiving, and I feel like my own hard work has been overlooked.","It's not fair that she gets all the attention and accolades, while I'm just as dedicated and hardworking. I can't help but feel envious and wonder what I'm doing wrong."
42,Female,Teacher,Married,"My neighbor just came back from a luxurious vacation to Europe, and I can't afford to take my family on a trip like that.","I feel envious of my neighbor's ability to travel and experience new things, while I'm stuck at home with limited resources.","I wish I could provide my family with the same kind of experiences and adventures. It's not fair that some people can afford to do whatever they want, while others have to struggle just to get by. I can't help but feel envious and resentful."
42,Female,Teacher,Married,I was grading papers late at night when I heard a loud bang coming from downstairs.,"I felt a sudden rush of fear and panic, my heart started racing, and I froze in place.","Oh my god, someone might have broken into our house! What if they hurt me or my family? I don't know what to do!"
42,Female,Teacher,Married,"During a parent-teacher conference, a parent started yelling at me, accusing me of being incompetent and not doing enough for their child.","I felt a wave of fear and anxiety wash over me, and I started to tremble. I was scared of the confrontation and worried about the consequences.",What if they file a complaint against me? I could lose my job! I'm not sure I can handle this pressure. Maybe I'm not cut out for teaching.
42,Female,Teacher,Married,My husband came home late from work and seemed distant. He didn't want to talk about his day.,"I felt a growing sense of fear and insecurity. My stomach was in knots, and I couldn't stop worrying.","Is he having an affair? What if he doesn't love me anymore? I'm afraid our marriage is falling apart, and I don't know how to fix it."
42,Female,Teacher,Married,"I received a call from the doctor's office, asking me to come in to discuss the results of my recent medical tests.",I was gripped by fear and couldn't stop shaking. My mind started racing with worst-case scenarios.,What if it's cancer? I'm terrified of dying and leaving my children without a mother. I don't know how I'll cope if it's something serious.
42,Female,Teacher,Married,"I was driving my kids to school when another car suddenly cut me off, nearly causing an accident.","I was filled with fear and felt my chest tighten. My hands were shaking on the steering wheel, and I had trouble catching my breath.",We could have been killed! What if I'm not able to keep my children safe? I'm so afraid of something happening to them.
42,Female,Teacher,Married,"I spent hours preparing a lesson plan, but my students were unresponsive and disengaged during the class.",I feel so frustrated and disappointed. It's like all my efforts were for nothing.,Am I not a good enough teacher? Why can't I seem to get through to my students?
42,Female,Teacher,Married,"My husband forgot our anniversary dinner reservation, and now we have to wait an hour for a table.",I'm so frustrated and angry. How could he forget something so important?,Does he even care about our relationship? I put so much effort into making this night special.
42,Female,Teacher,Married,"I've been trying to help my son with his math homework, but he just doesn't seem to understand the concepts.","I'm feeling so frustrated and helpless. No matter how much I explain, he just doesn't get it.",Am I failing as a parent? Why can't I help my own child succeed academically?
42,Female,Teacher,Married,The school administration decided to cut funding for the art program I've been running for years.,I'm incredibly frustrated and disappointed. This program means so much to the students and me.,Don't they see the value in what I'm doing? Why is art always the first thing to be cut?
42,Female,Teacher,Married,"I spent hours cooking a special dinner for my family, but my children refused to eat it and complained about the food.",I feel so frustrated and unappreciated. I put so much love and effort into this meal.,Why do I even bother trying to make nice things for my family if they don't appreciate it?
42,Female,Teacher,Married,My husband was diagnosed with terminal cancer.,I feel an overwhelming sense of grief and sadness. I can't imagine life without him.,How will I cope with this loss? What will happen to our family? I don't know if I'm strong enough to handle this.
42,Female,Teacher,Married,My eldest child moved out of the house to attend college in another state.,"I'm proud of their accomplishments, but I feel a deep sense of loss and emptiness.",The house feels so quiet without them. I miss our daily conversations and family dinners. It's like a part of me is missing.
42,Female,Teacher,Married,My best friend since childhood passed away unexpectedly.,I'm in shock and feel a profound sense of grief. I can't believe they're gone.,We had so many memories together. I keep expecting them to call or text me like they always did. I don't know how to process this loss.
42,Female,Teacher,Married,The school where I've taught for 15 years is closing down due to budget cuts.,I feel a sense of grief and loss. This school has been a huge part of my life.,I've invested so much time and energy into my students and this community. It feels like I'm losing a part of my identity. What will I do now?
42,Female,Teacher,Married,My beloved pet dog passed away after 14 years together.,I'm heartbroken and grieving the loss of my loyal companion.,Coming home to an empty house without their wagging tail and happy greeting is devastating. I feel like I've lost a family member.
42,Female,Teacher,Married,I forgot to pick up my daughter from her ballet class because I was busy grading papers.,I feel incredibly guilty for letting my daughter down and not being there for her when she needed me.,I'm a terrible mother. I should have prioritized my daughter over my work. She must be so upset and disappointed in me.
42,Female,Teacher,Married,"I snapped at my husband this morning because I was stressed about work, and now he's giving me the silent treatment.",I feel guilty for taking my stress out on my husband. He doesn't deserve to be treated that way.,I'm a bad wife. I shouldn't have let my work stress affect my relationship. I need to apologize and make it up to him.
42,Female,Teacher,Married,"I forgot to submit my son's permission slip for a field trip, and now he can't go with his classmates.",I feel so guilty for letting my son down. He was really looking forward to this field trip.,I'm a forgetful and irresponsible parent. My son must be so disappointed in me. I should have been more organized.
42,Female,Teacher,Married,"I didn't have time to volunteer for the school fundraiser because of my heavy workload, and now I feel like I'm not contributing enough to my children's school.",I feel guilty for not being more involved in my children's school activities. I should be setting a better example.,I'm not doing enough as a parent. Other parents are more involved than I am. I need to find a way to balance my work and family responsibilities better.
42,Female,Teacher,Married,I missed my best friend's birthday celebration because I double-booked myself with a work event.,"I feel guilty for prioritizing work over my friendship. My friend is always there for me, and I let her down.",I'm a terrible friend. I should have remembered her birthday and made sure to be there for her. She must think I don't value our friendship.
42,Female,Teacher,Married,I found out that my husband has been cheating on me with a younger woman for the past year.,I feel an intense hatred towards my husband for betraying our marriage vows and destroying our family. I also hate the woman he cheated with for knowingly pursuing a married man.,"How could he do this to me after all these years? I trusted him completely, and he shattered that trust. I hate him for being so selfish and putting his desires above our family. That woman is a homewrecker, and I hate her for not caring about the consequences of her actions."
42,Female,Teacher,Married,"One of my students falsely accused me of inappropriate behavior, leading to a school investigation and damaging my reputation.","I am filled with hatred towards this student for lying and trying to ruin my career. I have always been a dedicated and professional teacher, and now my integrity is being questioned.",I can't believe this student would make up such a horrible lie. I hate that they are willing to destroy my life just to get back at me for giving them a bad grade. I hate the school administration for not immediately seeing through this false accusation and for putting me through this humiliating investigation.
42,Female,Teacher,Married,"My best friend betrayed me by sharing my deepest secrets with our entire friend group, humiliating me and breaking my trust.","I am consumed by hatred for my so-called best friend. I confided in her, and she used my secrets against me. I feel exposed and betrayed.",I hate her for being so two-faced and disloyal. She pretended to be my friend while gossiping about me behind my back. I hate that she made me look foolish in front of our friends and that I can never trust her again.
42,Female,Teacher,Married,"A coworker took credit for a successful project that I had spent months working on, and they received a promotion as a result.","I am seething with hatred for this coworker. They stole my hard work and used it to advance their own career, leaving me with nothing.","I hate this backstabbing coworker for being so dishonest and manipulative. They knew how much effort I put into that project, and they still had the audacity to claim it as their own. I hate that the school administration couldn't see through their lies and rewarded them instead of me."
42,Female,Teacher,Married,"My in-laws constantly criticize my parenting skills and undermine my authority with my children, causing tension in my marriage.",I feel a deep hatred for my in-laws and their constant interference in my life. They make me feel like an inadequate mother and cause problems in my marriage.,"I hate how my in-laws think they know better than me when it comes to raising my own children. I am their mother, and I should be the one making decisions about their upbringing. I hate that they disrespect me and that my husband doesn't always stand up for me, making me feel unsupported and alone."
42,Female,Teacher,Married,"I couldn't control my class today, and the students were running wild. I felt like I had no authority.",I feel so helpless and powerless. I don't know how to regain control of my classroom.,I'm a terrible teacher. I can't even manage my own students. What's wrong with me?
42,Female,Teacher,Married,"My husband and I got into a huge argument, and he stormed out. I don't know if he's coming back.","I feel so helpless and alone. I can't fix this on my own, and I don't know what to do.",What if he leaves me? I can't raise our children by myself. I'm not strong enough to handle this.
42,Female,Teacher,Married,"One of my children is struggling in school, and I don't know how to help them.","I feel so helpless as a parent. I want to support my child, but I don't have the tools or knowledge.","I'm failing as a mother. My child is suffering, and I can't do anything about it."
42,Female,Teacher,Married,"I applied for a promotion at work, but it was given to someone else. I feel stuck in my career.",I feel helpless and trapped in my current position. I don't know how to advance my career.,I'll never be good enough to move up. I'm destined to be a mediocre teacher forever.
42,Female,Teacher,Married,"My best friend is going through a tough time, but I don't know how to support her.","I feel helpless as a friend. I want to be there for her, but I don't know what to say or do.","I'm a terrible friend. She needs me, and I'm letting her down. I should be able to fix this."
42,Female,Teacher,Married,I found out that my husband has been having an affair with a younger woman.,I feel utterly devastated and betrayed. It's like my entire world has been shattered.,I don't know how I can ever trust him again. Our marriage is probably over. I feel so hopeless about my future.
42,Female,Teacher,Married,One of my children has been diagnosed with a severe learning disability.,I'm overwhelmed with sadness and worry for my child's future. I feel like I've failed as a parent.,How will my child ever be able to lead a normal life? I don't know if I have the strength to handle this. Everything seems so hopeless.
42,Female,Teacher,Married,I was passed over for a promotion at work that I had been working towards for years.,I feel so disappointed and let down. It's like all my hard work was for nothing.,I'll never be able to advance in my career. I'm stuck in this dead-end job forever. There's no hope for my future.
42,Female,Teacher,Married,"My best friend, who I've known since childhood, has decided to end our friendship.",I'm heartbroken and confused. I feel like I've lost a part of myself.,I don't know what I did wrong. I'll never be able to find another friend like her. I'm destined to be alone and miserable.
42,Female,Teacher,Married,I've been diagnosed with a chronic illness that will require lifelong treatment.,I'm terrified and overwhelmed. I feel like my life is over.,I don't know how I'll be able to cope with this illness. I'll never be able to live a normal life again. Everything is hopeless.
42,Female,Teacher,Married,I accidentally sent a personal email meant for my husband to my entire class.,I feel so embarrassed and humiliated. I can't believe I made such a careless mistake.,My students and their parents will think I'm unprofessional. They might lose respect for me as a teacher.
42,Female,Teacher,Married,"During a parent-teacher conference, a parent critiqued my teaching methods in front of other parents.",I feel belittled and humiliated. It was so embarrassing to be called out like that in front of other people.,I must be a terrible teacher if a parent feels the need to criticize me publicly. Other parents probably agree with them.
42,Female,Teacher,Married,"I tripped and fell in the school cafeteria, spilling food all over myself in front of my students and colleagues.",I'm so mortified. I can feel everyone staring at me and judging me.,I look like a complete fool. My students will never take me seriously again after seeing me like this.
42,Female,Teacher,Married,"My husband made a joke about my cooking skills in front of our friends, and everyone laughed.",I feel so humiliated and betrayed. How could he mock me like that in front of our friends?,Everyone must think I'm a terrible wife and homemaker. They probably pity me or think I'm pathetic.
42,Female,Teacher,Married,"I forgot my lines during a school play I was directing, and I had to ask a student for help.",I'm so ashamed and embarrassed. I should have been better prepared.,I've let my students down and made a fool of myself. They'll never respect me as a director again.
42,Female,Teacher,Married,"I overheard my husband complimenting a younger, more attractive colleague at the school's faculty party.","I felt a pang of jealousy and insecurity, wondering if he finds her more appealing than me.",Am I not attractive enough anymore? Is he losing interest in me after all these years?
42,Female,Teacher,Married,My daughter told me that her friend's mom is 'cooler' than me and lets them do more fun activities together.,I felt inadequate as a mother and questioned my parenting skills.,Am I not fun enough? Am I failing as a mother compared to other moms?
42,Female,Teacher,Married,"I struggled to keep up with the new technology being implemented in the classroom, while younger teachers seemed to adapt effortlessly.",I felt insecure about my abilities as a teacher and worried that I might be falling behind.,Am I becoming obsolete in my profession? Will I be able to keep up with the changing times?
42,Female,Teacher,Married,I noticed wrinkles and age spots on my face while getting ready for a school event.,I felt self-conscious about my appearance and worried that others would judge me for looking older.,Am I no longer attractive? Will people think less of me because of my age?
42,Female,Teacher,Married,"My husband and I had an argument about our finances, and he implied that I'm not contributing enough to our household income.",I felt insecure about my value as a partner and questioned my role in our marriage.,Am I not doing enough to support our family? Does he resent me for not earning as much as him?
42,Female,Teacher,Married,"I found out that my husband forgot to pay the electricity bill, even though I reminded him several times.",I feel really irritated and annoyed that he didn't listen to me and take care of this important task.,"Why can't he just remember to do these simple things? I have enough on my plate with work and the kids, and now I have to deal with this too."
42,Female,Teacher,Married,One of my students constantly interrupts me during class and disrupts the lesson for everyone else.,I'm so irritated by this student's behavior. It's disrespectful and makes it hard for me to teach effectively.,"I've tried talking to this student before, but nothing seems to work. I'm at my wit's end and don't know how to handle this situation anymore."
42,Female,Teacher,Married,"My children left their toys scattered all over the living room floor, even after I asked them to clean up before dinner.",I'm irritated that they didn't listen to me and follow through with their responsibilities.,I feel like I'm constantly nagging them to clean up after themselves. Why can't they just do what they're asked without me having to repeat myself?
42,Female,Teacher,Married,"I was stuck in traffic for over an hour on my way home from work, making me late for dinner with my family.",I'm so irritated by this unexpected delay. I hate being late and letting my family down.,"This traffic is ridiculous. I should have taken a different route or left work earlier. Now everyone is waiting on me, and I feel guilty."
42,Female,Teacher,Married,"My colleague took credit for a project that I had worked on, and my boss praised them instead of me.",I feel irritated and frustrated that my hard work wasn't acknowledged. It's not fair that someone else is getting the recognition.,"I put in so much effort on this project, and now it feels like it was all for nothing. I should have spoken up and made sure my boss knew my contributions."
42,Female,Teacher,Married,"I saw my husband laughing and chatting with a younger, attractive female colleague at a school event.",I felt a strong sense of jealousy and insecurity when I saw them together.,Is he attracted to her? Does he find her more interesting than me? Am I not enough for him anymore?
42,Female,Teacher,Married,"My best friend got promoted to a higher position than me at work, even though we started at the same time.",I felt jealous and resentful towards my friend for getting the promotion over me.,Why did she get the promotion and not me? Am I not good enough? Does everyone think she's better than me?
42,Female,Teacher,Married,My sister-in-law bought a bigger house in a better neighborhood than ours.,I felt envious and inferior when I heard about their new house.,Why can't we afford a house like that? Are we not as successful as they are? Will people think less of us?
42,Female,Teacher,Married,"My colleague received praise from the principal for a project I worked on too, but my contribution wasn't mentioned.",I felt jealous and unappreciated when my colleague was praised and I wasn't acknowledged.,Why didn't the principal recognize my work? Does everyone think my colleague did all the work? Am I not valued?
42,Female,Teacher,Married,"My children seem to prefer spending time with their fun, energetic aunt over me.",I felt jealous and hurt when I saw how much fun my kids were having with their aunt.,Do my children love her more than me? Am I not fun enough for them? Are they going to want to spend more time with her than with me?
42,Female,Teacher,Married,"I came home from a long day at school, and my husband and children were all busy with their own activities. No one seemed to notice I was there.","I felt invisible and unimportant, like my presence didn't matter to my family. It made me feel incredibly lonely.",Am I not a priority to my own family? Do they not care about me or appreciate all that I do for them?
42,Female,Teacher,Married,"During lunch break at school, I saw my colleagues laughing and chatting together, but no one invited me to join them.",I felt excluded and isolated from my co-workers. It made me question whether they actually like me or if I'm just an outsider.,Why don't they want to include me? Am I not fun to be around or likeable enough?
42,Female,Teacher,Married,"My husband and children went on a weekend trip without me because I had to grade papers. They seemed excited to go, and no one seemed to mind that I couldn't join.",I felt left out and abandoned by my own family. It made me feel like I'm not an important part of their lives.,Do they not miss me when I'm not around? Am I holding them back from enjoying their lives?
42,Female,Teacher,Married,I scrolled through social media and saw pictures of my friends hanging out together without me. No one had invited me or even mentioned the get-together to me.,I felt forgotten and unimportant. It made me wonder if my friends actually consider me a close friend or if I'm just an afterthought.,Why didn't they want me there? Do they not enjoy my company or value our friendship?
42,Female,Teacher,Married,"I reached out to my sister to chat, but she said she was too busy to talk. This is the third time in a row she's brushed me off.",I felt rejected and alone. It made me feel like I don't have anyone to turn to when I need support or just want to connect.,Does my own sister not care about me or want to make time for me? Am I not a priority in her life?
42,Female,Teacher,Married,I found an old photo album from when my children were little and realized how quickly time has passed.,I felt a deep sense of melancholy and longing for those precious moments that have gone by so fast.,Where did the time go? I miss when my kids were small and needed me more. It's bittersweet to see them grow up.
42,Female,Teacher,Married,"I heard a song on the radio that reminded me of my late father, who passed away a few years ago.","The song brought back a wave of melancholy and sadness, making me miss my father's presence in my life.","I wish I could talk to my dad one more time. It's hard to accept that he's gone, and I feel a sense of longing for his guidance and love."
42,Female,Teacher,Married,"I watched a movie that had a bittersweet ending, which left me feeling contemplative about my own life choices.",The movie's ending evoked a melancholic mood and made me question whether I've made the most of my life so far.,Have I pursued my dreams and passions enough? Is there more I could have done? The movie made me reflect on my own journey with a tinge of sadness.
42,Female,Teacher,Married,"I visited my hometown after many years and saw how much it had changed, with many of my favorite places gone.",Seeing the changes in my hometown filled me with a melancholic nostalgia for the past and a sense of loss.,"It's sad to see how much has changed. I have so many fond memories tied to these places, and now they're gone. It makes me feel like a part of my history has disappeared."
42,Female,Teacher,Married,I attended a family gathering and realized that my children are now the age I was when I first became a parent.,"This realization brought about a melancholic feeling, making me reflect on the passage of time and my own mortality.","Time moves so quickly. It seems like just yesterday I was a new parent, and now my children are grown. It's a reminder that life is fleeting, and I need to cherish every moment."
42,Female,Teacher,Married,I found out that my husband has been cheating on me with one of my colleagues at school.,"I feel utterly devastated, betrayed, and humiliated. My world has been shattered, and I don't know how I'll ever recover from this.",How could he do this to me after all these years? I thought our marriage was strong. I feel like a fool for not seeing the signs. What will people think of me now?
